{
  "$schema": "./schema.json",
  "app_id": "ember",
  "app_name": "Ember Supply",
  "bundle_identifier": "com.ember.app",
  "base_url": "https://ember.example",
  "surface": "store",
  "launch_path": "/",
  "deep_link_scheme": "ember",
  "identity_provider": "inneranimalmedia",
  "icon_set": "icons/ember",
  "theme": {
    "primary_color": "#18181b",
    "accent_color": "#f59e0b"
  },
  "feature_flags": {
    "tray": true,
    "auto_update": true,
    "local_execution_node": false
  }
}
